{
  "files_in_scope": [
    "src/auth/login.py",
    "src/auth/token.py",
    "tests/test_login.py"
  ],
  "dirs_in_scope": [],
  "assumptions": [
    {
      "text": "The login bug is caused by token expiry not being checked",
      "verified": false
    },
    {
      "text": "tests/test_login.py contains existing test coverage for the login flow",
      "verified": true,
      "verification_method": "file exists and contains 'def test_login'"
    }
  ],
  "risk_level": "low",
  "approval_required": false,
  "task_summary": "Fix login bug where expired tokens are not rejected",
  "created_at": "2026-04-06T10:00:00+0800",
  "revisions": []
}
